{
  "schema": "midbrain.effector_alignment_profile",
  "schema_version": 1,
  "profile_id": "rebot_b601_dm_gripper",
  "profile_revision": "rebot-b601-dm-gripper-alignment-v3",
  "display_name": "reBot B601-DM Bare Gripper",
  "assembly_type": "REPLACEABLE_EFFECTOR",
  "qualification_state": "DEVELOPMENT",
  "robot_compatibility": {
    "model_id": "rebot_arm_b601_dm",
    "model_revision": "rebot-official-fixed-end-0.1.21-pos-speed-motor-envelope",
    "arm_base_frame": "rebot_arm_base",
    "terminal_frame": "rebot_arm_tool",
    "controlled_frame": "rebot_arm_tool"
  },
  "kinematic_attachment": {
    "source_schema": "physical_agent.robot_arm_model",
    "source_reference": "providers/rebot_arm_dm/config_templates/arm_model.factory.json#/fixed_tool",
    "parent_link": "link6",
    "controlled_link": "end_link",
    "terminal_joint_to_controlled_frame": {
      "translation_m": [
        0.0,
        0.0,
        0.15539
      ],
      "rpy_rad": [
        0.0,
        -1.5708,
        3.1415
      ]
    },
    "qualification": "NOMINAL_URDF",
    "replacement_policy": "A held tool or replacement effector requires a new profile revision with its own qualified terminal-joint-to-controlled-frame geometry. Do not inherit the bare-gripper attachment implicitly."
  },
  "capture_motion_policy": {
    "maximum_landmark_motion_m": 0.005,
    "additional_camera_timing_margin_us": 20000,
    "arm_transform_timestamp_semantics": "MEASURED_JOINT_BATCH_ACQUISITION_ESTIMATE",
    "arm_feedback_age_field_path": [
      "data",
      "feedback_age_ms"
    ],
    "fallback_arm_feedback_age_ms": 20.0,
    "maximum_arm_feedback_age_ms": 100.0,
    "preferred_arm_feedback_observation_age_ms": 100.0,
    "maximum_transform_wait_ms": 1500.0,
    "transform_retry_interval_ms": 10.0,
    "temporal_sample_count": 5,
    "qualification": "DEVELOPMENT_DEFAULTS_REQUIRE_LIVE_TIMING_REFINEMENT",
    "policy_note": "The DM arm joint-state and FK transform timestamps describe the estimated measured-joint acquisition interval, with uncertainty reported in data.feedback_timing. The host therefore does not add feedback age to those timestamps. Another arm or effector profile must declare its own timestamp semantics explicitly."
  },
  "refinement_policy": {
    "second_vlm_review_raw_delta_threshold_m": 0.005,
    "maximum_raw_translation_delta_m": 0.1,
    "maximum_adopted_translation_delta_m": 0.025,
    "minimum_landmark_confidence": 0.75,
    "minimum_same_surface_confidence": 0.75
  },
  "default_visual_alignment_landmark": "rail_lateral_endpoint_mean",
  "landmark_fallback_policy": {
    "selection_order": [
      "rail_lateral_endpoint_mean",
      "gripper_tip_pair_mean"
    ],
    "automatic_substitution_allowed": false,
    "no_hardware_modification_strategy": "Prefer a qualified rigid proximal feature with reliable same-surface depth, such as the neon-green Rail-Bracket, when the controlled tip or attached tool is reflective or occluded.",
    "optional_physical_fiducial_policy": "A non-reflective ball may be added in a separately revised profile, but baseline operation must not require that modification."
  },
  "visual_alignment_landmarks": [
    {
      "landmark_id": "gripper_tip_pair_mean",
      "display_name": "Bare gripper tip-pair mean",
      "geometry": "MEAN_OF_REGISTERED_3D_POINTS",
      "required_point_ids": [
        "gripper_tip_left",
        "gripper_tip_right"
      ],
      "description_for_vlm": "Locate the foremost physical peak of each bare gripper jaw. Select the named peak in RGB, then independently select a valid registered-depth pixel on the same physical jaw-tip surface. Do not select the work object, background, highlight, or nearest unrelated foreground.",
      "tool_point_binding": {
        "source": "CONTROLLED_FRAME_ORIGIN",
        "runtime_key": null,
        "controlled_frame_to_landmark_translation_m": [
          0.0,
          0.0,
          0.0
        ],
        "landmark_to_controlled_frame_translation_m": [
          0.0,
          0.0,
          0.0
        ],
        "qualification": "USER_CONFIRMED_CURRENT_IK_FK_GRIPPER_TIP_POINT"
      },
      "pair_separation_m": {
        "minimum": 0.001,
        "maximum": 0.25,
        "nominal": null,
        "qualification": "JAW_STATE_DEPENDENT"
      },
      "visibility": {
        "material_note": "Jaw peaks may be reflective or lack exact depth.",
        "missing_exact_depth_policy": "VLM_RESELECT_ONCE_THEN_REJECT"
      }
    },
    {
      "landmark_id": "rail_lateral_endpoint_mean",
      "display_name": "Neon-green Rail-Bracket lateral midpoint",
      "geometry": "MEAN_OF_REGISTERED_3D_POINTS",
      "required_point_ids": [
        "rail_lateral_left",
        "rail_lateral_right"
      ],
      "description_for_vlm": "Always locate the two opposite lateral terminal-face centers of the rigid neon-green gripper Rail-Bracket, then use their mean as the observed rail center. Select the neon-green rail endpoints, not either jaw tip, not the space between the jaws, and not any work object. For each endpoint, select the physical feature in RGB and a valid registered-depth pixel on that same terminal face, slightly inside the silhouette rather than on a mixed foreground-background edge. Do not move either selection toward the gripper tip; the effector profile applies the measured rail-center-to-tip offset deterministically.",
      "tool_point_binding": {
        "source": "USER_MEASURED_RIGID_OFFSET",
        "runtime_key": null,
        "controlled_frame_to_landmark_translation_m": [
          -0.08,
          0.0,
          0.0
        ],
        "landmark_to_controlled_frame_translation_m": [
          0.08,
          0.0,
          0.0
        ],
        "qualification": "USER_MEASURED_2026_08_07",
        "measurement_note": "The measured vector from the neon-green rail center to the controller IK/FK tip is +80 mm along the controlled/final-joint +X axis. The solver consumes the inverse vector from the controlled-frame origin to the observed rail center, which is -80 mm on controlled-frame X."
      },
      "pair_separation_m": {
        "minimum": 0.16,
        "maximum": 0.20,
        "nominal": 0.18406952,
        "qualification": "CAD_BOUND_APPROXIMATION_REQUIRES_PHYSICAL_CONFIRMATION"
      },
      "visibility": {
        "material_note": "The physical Rail-Bracket is strongly visible neon green; the retained CAD atlas uses neutral blue-grey rendering.",
        "missing_exact_depth_policy": "VLM_RESELECT_ONCE_THEN_REJECT"
      },
      "cad_asset_ids": [
        "rebot_b601_dm.rail_bracket.step.v1",
        "rebot_b601_dm.gripper_centered_mesh.v1",
        "rebot_b601_dm.gripper_reference_atlas.v1"
      ],
      "relationship_to_controlled_frame": "MEASURED_RIGID_OFFSET_RAIL_CENTER_TO_IK_TIP_PLUS_X_0P080_M"
    }
  ],
  "action_frames": [
    {
      "frame_id": "rebot_arm_tool",
      "semantic_role": "IK_CONTROLLED_FRAME",
      "coincident_visual_landmark_id": "gripper_tip_pair_mean",
      "default_visual_alignment_landmark_id": "rail_lateral_endpoint_mean",
      "note": "The controller IK/FK point remains the gripper-tip pair mean. Visual refinement observes the neon-green rail center by default, then applies the user-measured rail-center-to-tip vector [+0.080, 0, 0] m along controlled-frame +X; equivalently, the rail center is [-0.080, 0, 0] m in controlled-frame coordinates."
    }
  ],
  "invalidation_conditions": [
    "Effector replacement or remount",
    "Tool slip or a changed held-tool assembly",
    "Robot-model or controlled-frame revision change",
    "Camera calibration or stationary mounting identity change",
    "A required runtime landmark binding becomes unavailable"
  ]
}
